{
  "record_version": "1.0.0",
  "record_id": "browser-baseline-local-fixture-v1:fixture-session-001:1",
  "manifest_id": "browser-baseline-local-fixture-v1",
  "cognit_commit": "0123456789abcdef0123456789abcdef01234567",
  "protocol_version": "browser-baseline-protocol-1",
  "config": {"challenge_count": 1, "duration_ms": 50, "mode": "fixed-demo"},
  "config_sha256": "f02199fb5a160abd186a5e3ba51eb94b855c44aefcc88efb662e29ade6c23e10",
  "seed": "issue-47-fixture-seed",
  "tool_version": "1.0.0-fixture",
  "browser": "Chromium",
  "browser_version": "130.0.0-fixture",
  "framework": "playwright",
  "target_source": "cognit-fixed-demo",
  "target_origin": "http://127.0.0.1:4173",
  "session_id": "fixture-session-001",
  "attempt_id": "fixture-session-001-1",
  "challenge_id": "fixture-challenge-001",
  "evidence_class": "SIMULATED",
  "actor_class": "AUTOMATION_CONTROLLED",
  "oracle_access": true,
  "oracle_source": "runner.ground_truth.expected_answer",
  "observed_result": {"challenge_id": "fixture-challenge-001", "correct": true, "duration_ms": 50},
  "perception_metric_eligible": false
}
